comment,pos
"受黑格比影响,45日将有大风降雨,请注意安全",0
"广西多地暴雨引发洪涝,国家防总启动防汛Ⅳ级响应",1
刚刚平凉市部分县区遭冰雹侵袭最大宛如鸡蛋政务澎湃新闻ThePaper,4
"3.4级轻微地震密歇根州(墨西哥)周一,79公里alSUROESTEdeCOALCOMAN,2020年7月13日",3
贵州、广西、吉林等地有大雨局地有雷暴大风,0
暴雨侵袭浙江全省多座水库超汛限浙江新闻浙江在线,2
梧州:端午假期降雨频繁局部有暴雨天气广西新闻网,2
我市启动气象灾害暴雨、大风Ⅳ级应急响应,2
中新网湖北湖北新闻网双节期间一头一尾多云中间插播七级大风暴雨降温,2
《农民年鉴》预测康涅狄格州的冬季晚些时候会有大风暴,0
暴雨高温今天江苏这些地方仍有强降雨,1
"3.2级小地震2020年8月16日星期日,阿拉斯加(美国)科尔多瓦东南偏南136公里处",3
暴雨、大暴雨、雷暴大风强对流天气今晚又来,2
"波特兰地铁10万在大风中失去电力由于火灾风险,PGE抢先切断胡德山附近的电力",0
"未来5天上海将有大雨到暴雨过程,最大降水可达300毫米",1
气候科学家将把无情的风暴和洪水摧毁越南中部置于显微镜下越南,1
秦安县领导检查指导郭嘉镇冰雹灾害生产自救工作,4
东莞强降水及冰雹已致8人死亡136人受伤,4
"2.9级小地震2020年7月22日星期三,大方索省长(达沃东方)(菲律宾)东经68东经035公里",3
未来两小时黑龙江省多地将出现雷雨大风天气局地伴有冰雹,4
洛杉矶记录的36级地震,3
山西平顺遭遇暴雨冰雹县城及部分乡镇发生内涝闽南网,4
今年汛期重庆共出现11场暴雨天气四区县汛期降水量突破历史极值,2
暴雨来袭江西启动防汛四级应急响应接下来的天气媒体澎湃新闻ThePaper,2
警惕暴雨高温大风将袭击贵州,0
武汉启动城市排渍Ⅲ级应急响应重庆暴雨致21万余人受灾,2
"注意大暴雨特大暴雨,强势来袭,未来3天(2830号)天气预报",2
强对流天气上线冰雹又来明后两天青岛大部地区有阵雨或雷雨,4
暴雨大暴雨河南被雨刷屏郑州雨要下15天,1
霜冻降温大风雨雪内蒙古2至5日天气是这样的,0
"山东继续一到周末就下雨,还有40毫米强中心,大风冰雹要警惕",4
暴雨、山洪暴发在卡纳塔克邦造成严重破坏正常生活中断,2
"洪水产品的建议,手表和警告都有不同的含义",1
尼日利亚洪水摧毁了北部的农作物和房屋,1
"雷暴大风强降水,今天还要来政务澎湃新闻ThePaper",0
"保定博野天气:雨、大风、降温将至,周末出行注意保暖",0
"爱尔兰天气:梅特埃利安警告说,这几天由于暴雨和狂风天气要来袭",2
"3.8级小地震2020年8月3日,星期一,OAX(墨西哥)60公里alSUROESTEdeSPEDROPOCHUTLA",3
"黑龙江省告别了强降水,阵雨模式开启还要注意雷暴大风、冰雹",4
优先考虑尼泊尔洪水问题印度动态,1
"3.4级小地震密歇根州米拉市苏罗伊斯特124公里,2020年8月16日星期日",3
"强降雨,大风袭击塔斯马尼亚,低压系统将向西北各州进发",0
黄河2020年第1号洪水进入宁夏较往年提前2天,1
墨西哥7.5级地震后已累计发生余震147次,3
阵雨大风霜冻降温来啦,0
长沙启动气象灾害(暴雨)IV级应急响应,2
甘肃迎来大风降温及霜冻天气,0
2020年7月25日星期六土耳其西部2.7级小地震,3
2020年6月26日星期五智利安托法加斯塔3.7级小地震,3
黑龙江人注意强降水雷暴大风冰雹拍了拍你,4
2020年8月15日星期六印度尼西亚巴厘岛南部2.7级小地震,3
重庆7区遭遇暴雨袭击降雨过程将持续至23日,2
吉林:启动雪灾冻害大风四级应急响应中国气象局政府门户网站,0
入汛以来最强降雨袭湘西部中部将现大范围暴雨大暴雨,1
"暴雨预报未来三天雨势凶猛,局地伴有强对流天气",2
杰森高格斯预报:今天有大风和阵雨,0
信阳地区将迎来大到暴雨注意预防山洪地质灾害等,1
台湾南部、中部地区遭遇灾难性降雨,1
"强降雨、雷暴、短时大风都来,享受降温别忘防雷防雨",0
"中东部地区有较大范围降水,东北地区华北黄淮等地有大风降温",0
黑龙江人注意雷雨、大风、冰雹、强雷暴来了就在这些地区,4
东部和南部海区有大风冷空气将影响新疆北部地区,0
济南人注意紧急发布10级大风雷雨强降雨局部冰雹,4
天津日报周前期天气静稳有雾霾周中期大风降温来袭,0
熊本暴雨复兴县发表计划明确表示推进流水型水库,2
地震幸存者悼念亲人,3
暴风雪天气:冷锋带来大风和大的气温下降,0
与从暴雨中救过来的重建佛堂有着偶然的缘分,1
紧急甘肃暴发山洪、泥石流,1
"2020年6月18日,星期四,菲律宾东达沃省省长洛尼索(DavaoOriental)东南135公里处发生2.8级小地震",3
紧急提醒雷暴大风、短时强降水正在逼近媒体澎湃新闻ThePaper,0
更糟的事还会发生吗气候变化加剧海得拉巴洪水,1
北方人注意:坏雷雨又要来了权威提醒:河北山西是重点局部冰雹,4
"突发山东泰安突降冰雹,伴随狂风暴雨席卷而来",4
"九江:暴雨突袭水深达1米,小车被困水中,里面传来婴儿哭声",2
大雨再次避开东营大风小阵雨带来短暂清凉,0
"3.5级小地震2020年7月28日,星期二,OAX(墨西哥)特佩勒姆苏尔36公里处",3
"2020年8月18日,星期二,日本博宁群岛地区,5.5级中等地震",3
1888年印度冰雹被命名为历史上世界上最致命的天气事件,4
雷暴大风雷阵雨山西周末泡汤了,0
"盐城响水小尖镇遭遇8级大风:21人受伤,200多户房屋受损",0
龙卷风冰雹席卷希腊北部致6名外国游客死亡百余人受伤,4
"暴雨再次来袭,致敬乘风破浪的蜀黍政务澎湃新闻ThePaper",2
托皮卡西南部清晨房屋失火归咎于大风,0
大风、电线坠落导致大洛厄尔地区停电,0
"热带低气压β:密西西比州将出现暴雨,山洪暴发时系统经过",2
飓风埃塔肆虐中美洲多国遭暴雨袭击中新网,2
注意巴中、达州局地将有特大暴雨,1
江西湖南局地有大暴雨内蒙古山西等地部分地区有雷暴大风或冰雹社会人民网,4
云南昭通强降雨致多地出现山洪、泥石流等灾害,1
"3.9级小地震2020年8月5日,星期三,科隆(墨西哥)泰科曼河畔72公里",3
预计未来6小时内九江市西部等地区伴有短时强降水雷暴大风,0
"大雨袭击海岸,墙倒塌后有人死亡",1
江苏盐城遭龙卷风冰雹袭击已致51人死亡多人受伤中新网,4
"轻型4.4级地震苏门答腊岛(印度尼西亚)北部西海岸附近,2020年6月28日星期日",3
深圳今日有雷阵雨5日至7日局部暴雨伴有雷暴和8级左右大风,0
气候变化、经济活动带来巨大风险日本企业的意识变革,0
"3.9级轻微地震2020年7月2日,星期四,OAX(墨西哥)埃斯康迪多港25公里处",3
"未来三天,雨水不停大风、寒潮接连登场...政务澎湃新闻ThePaper",0
"3.2级轻微地震2020年8月16日星期日,格罗(墨西哥)阿卡普尔科28公里alSURESTEdeACAPULCO",3
暴雨导致皖湘黔等地受灾部分地区启动防汛应急响应,2
安徽1718日仍有持续强降水伴有8级左右雷暴大风,0
"枫普顿附近的野火被完全控制住了,刚好赶上大风",0
热带风暴埃塔在南佛罗里达州引发洪水,1
日本三大名城之一熊本城于6.5级地震中发生崩塌网友哀悼日本频道人民网,3
"山东钩状雨带形成,最大21.5毫米,半岛警惕局部暴雨和气旋大风",0
"中国发布丨注意未来10天这些地区将有暴雨,7月中旬后雨带移到北方",2
"风暴警报继续,该地区再次遭受山洪袭击",1
"四川木里暴雨引发泥石流,道路房屋被毁,但无人员伤亡",2
"新一轮大范围降雨横跨南北暴雨大雨中雨,811号天气预报",2
"四川乐山市马边县发生3.8级地震,震源深度14千米",3
"暴雨导致塌方,民房被毁,道路被堵缅甸钦邦难民举步维艰",2
忠县:暴雨致42米大树倒塌当地政府迅速开展抢险救援,2
保障演练在暴雨中打响,2
大雪大风,0
北约联军成员帮助阿富汗洪水灾民,1
"再升级贵州将防汛应急响应提升至Ⅲ级今晚,大暴雨来袭",2
内蒙古大部遭雨水暴击大雨、雷暴大风来袭,0
周刊地震信息20.8.27月30日(星期四)鸟岛近海地震的紧急地震速报也没有发生摇晃,3
"中央气象台:未来三天2527号,以下城市将暴雨如注,热不可耐",1
"2020年10月10日,星期六,印度莫昂西北偏西27公里处发生5.3级中等地震",3
昆明今起雨水减弱,1
防汛形势严峻南方入汛来第7轮强降雨将进入最强时段,1
"2020年8月8日,星期六,阿拉斯加(美国)佩德罗湾东32公里处发生3.8级小地震",3
视频今明两天重庆仍有雨要来局地或遭遇大到暴雨,2
昨日安徽122个站点出现大暴雨未来一周雨水持续在线,2
暴雨、大雨、中雨、小雨下周的天气让人崩溃,2
华北地区雷雨频繁广西东北部局地有大暴雨社会人民网,2
"3.7级小地震2020年7月23日星期四,萨拉加尼(达沃西方)(印度尼西亚)东南偏东345公里",3
卡车被大风吹翻新西兰奥克兰海港大桥交通拥堵数小时,0
河南全省降雨来了局地有雷暴大风,0
"天气:未来几天,新西兰将遭遇冰雹、山洪、龙卷风等雷暴袭击",4
冷冷冷大风降温雨雨雨未来几天河南多地天气大变,0
重庆17个区县出现暴雨3条河流水位超警戒超保证,2
"在下一个大风暴来袭之前,对风暴术语有什么了解",0
河东区域性暴雨经济损失逾8000万元河东,2
"紧急提醒今天万州超40℃,暴雨大风今晚来袭,大家千万别出门",0
"刚刚,暴雨来袭强降水还将持续贵阳累计最大雨量将达200毫米ZAKER新闻",2
垫江:暴雨引发山洪600余亩农作物受灾,1
"2020年8月17日,星期一,地中海(土耳其)2.9级小地震",3
紧急提醒江门要变天大雨雷暴短时大风上线,0
"雨水殷勤,这天有暴雨",1
"极端暴雨导致临海汇溪32名民工被困,警民火速救援",2
"中央气象台:未来两天(6月34日)全国天气预报,一大片大到暴雨",2
大暴雨5500多群众紧急转移四川日报电子版,2
雷暴大风来袭气温暴跌近20℃本周江苏天气太刺激,0
雨雨雨浙江今日雨水继续刷屏局地需防短时暴雨,2
"重庆万州一家五口被山洪围困,民警救援时险遭洪水冲走",1
"重庆多地暴雨,多条河流现超警戒水位洪水",1
"轻磁4.5级地震日本本州东海岸附近,星期五,2020年7月17日",3
大风大雨又要撞上周一早高峰市防汛部门:加强22日交通疏导,0
"中雨、大风、霜冻依次上阵,呼和浩特十一期间天气",0
四川冕宁特大暴雨致19人遇难3人失联北京青年报,2
"情况紧急鄂尔多斯一地因强降雨引发洪水,多人被困媒体澎湃新闻ThePaper",1
四川马尔康市一乡镇遭遇冰雹袭击部分比核桃还大,4
"降雨,大风,降温同时来袭跟炎热彻底告别",0
"10月6日,哈萨克斯坦将迎来大雾、大风、霜雪",0
"最低2℃,大风下雨,冷空气太强还有官宣",0
山东济南晚高峰时间遭遇强对流天气部分地区有冰雹和短时强降水,4
画面曝光露营遇冰雹狂风暴雨10分钟归平静苹果新闻网苹果日报,4
"2020年6月20日,星期六,2.7级小地震HraunuSkaga(冰岛)东部13.9公里",3
"周五可能会有大风雪进入周六,这是威斯康星州南部活动模式的一部分",0
广东省防风应急响应提升为Ⅲ级南部沿海地市将有暴雨,2
"2020年8月1日,星期六,阿富汗Bāzārak东北8公里处发生4.5级轻地震",3
抓紧分享大庆市16日21日中到大雨冰雹要来了大家注意预防,4
暴雨致部分道路受损浙江新昌清理坍方1800余立方米,2
"注意未来2小时内,市区、林甸南部、肇州等雷达回波明显伴短时强降水、冰雹等强对流天气媒体澎湃新闻ThePaper",4
巴基斯坦暴雨成灾已造成至少49人死亡176人受伤国际人民网,2
在暴雨中失去的我的爱车高台避难是不现实的,1
智利北部发生6.8级地震震源深度110千米,3
大风降温今天山东半岛等地阵风超6级多地有霜冻,0
"暴雨突袭广元,他们挺身而出媒体澎湃新闻ThePaper",2
3.7级小地震巴拿马阿穆列斯港9公里。2020年7月12日星期日,3
洪水致路面塌陷国道351线宝兴段中断四川新闻四川新闻网,1
"埃尔顿约翰被迫下台,他的演出因一场大风暴而取消",0
返程请注意大暴雨雷暴大风又双叒叕要上线了,0
注意强降雨即将抵达,1
紧急通知中雨大雨雷暴大风本周还有两次强降雨天气,0
时隔数日墨西哥瓦哈卡州再地震,3
大风警报值班和火灾天气警报,0
"暴雨致广汽本田工厂新车被淹,涉及飞度缤智等,如何鉴别泡水车",2
"部分地区发布龙卷风警报,风速达每小时70英里,大冰雹也有可能",4
未来十天湘中以北将发生持续性暴雨洪水过程,1
大雨、暴雨、冰雹马上到河北媒体澎湃新闻ThePaper,4
华容一蓄洪垸溃堤紧急转移2.36万人,1
大风警报湖岸洪水警报,0
"星期三大雨将持续,洪灾威胁持续",1
9省市部分地区大到暴雨南方新一轮降雨最强上海热线教育频道,2
"2020年6月26日,星期五,马奈(达沃东方)(菲律宾)88E以北042公里的3.5级小地震",3
每日新报数字报刊平台将迎大风降温,0
宜昌暴雨致多地发生险情当地消防转移营救一千多人,2
罕见冰雹袭击闽北死亡2人直接经济损失3.4亿――中新网,4
10级大风雨水大军已杀到辽宁明日雨水范围缩小,0
居民被告知要清理排水沟的树叶以防洪水泛滥,1
"3.4级小地震2020年7月24日星期五,克尔曼沙赫(伊朗)萨尔波尔扎哈12公里处",3
更新丨新疆于田今天发生6.4级地震另有3.0级以上余震8次,3
尤卡坦严重洪灾,1
湖北三部门总结农业洪涝防灾减灾救灾服务合作成效中国气象局政府门户网站,1
更新:区域处理大风暴造成的损害,0
图集福建水口水电站开闸泄洪,1
突发平凉市部分县区遭冰雹侵袭最大宛如鸡蛋,4
天气预报:河南局地特大暴雨中旬将旱涝急转分析:可能是bug,2
黄河出现今年第1号洪水黄河上游水旱灾害防御Ⅳ级应急响应启动,1
雷暴大风大雨齐聚吉林,0
直击安庆洪水,1
甘肃永靖遭遇冰雹天气:16人受伤经济损失2.75亿元闽南网,4
"轻微3.4级地震危地马拉北部埃赫泰纳戈82公里,2020年8月11日,星期二",3
雨大雨暴雨保山等地滑坡泥石流等地质灾害风险较高,2
"轻磁4.0级地震2020年8月8日,星期六,OAX(墨西哥)萨利纳克鲁兹河畔35公里处",3
冰雹、非季节性降雨破坏小麦作物,1
台风海神将给普兰店带来降雨和较强大风,0
我市积极部署强降雨防汛工作,1
受大风影响舟山今天岛际水上客运部分航线停航浙江新闻浙江在线,0
"信阳暴雨,部分道路、桥梁被淹大河网",2
涼山州山洪暴發河邊賓館遭沖毀即時新聞兩岸on.cc東網,1
注意大风、暴雨冰雹又来要来临沂了媒体澎湃新闻ThePaper,4
贵州再次开启暴雨模式多地区地质灾害风险高,2
定西市市直单位干部职工向岷县漳县等洪涝灾区集中捐款,1
鸡蛋大冰雹袭击贵州镇宁县9人受伤3万余人受灾中新网,4
"日本千叶6.2级地震日本千叶县东北部地区25日凌晨发生6.2级地震,目前尚无人员伤亡和财产损失报告。据日本气象厅消息,地震发生于当地时间25日4时47分(北京时间3时47分),震级为6.2级,震中",3
"卢旺达洪水和泥石流最新情况(卢旺达气象局,NOAA,媒体)(2020年2月5日回声日报快讯)卢旺达",1
双休日北京雷雨仍将频繁来扰局地有大风冰雹注意安全,4
"阵风89级冰雹强雷暴,未来26小时我省多地将受雷雨大风天气影响",4
广东多地遭雷雨大风冰雹17人死亡153人受伤,4
贵州遵义多个乡镇遭受洪涝灾害消防已疏散受灾群众3000余人,1
"轻度4.8级地震2020年8月7日星期五,波多黎各,MagasArriba东南2公里处",3
沈铁积极应对管内雷雨大风天气,0
"2020年7月10日,智利阿塔卡马近海3.5级小地震",3
门罗县大风警报,0
"在登陆季节,区办公室准备应对洪水",1
今年洪涝已致千万人次受灾,1
"未来两小时,商洛这些地方将出现雷暴大风和冰雹天气",4
降温大风明后两天到山东最高直降10℃还有霜冻,0
"淅淅沥沥山西多地降雨持续,并伴有雷暴大风,最低温2℃",0
"今夜,广州又将开启倒水模式,局地10级雷暴大风",0
大风雷暴极端天气下如何安全行车,0
"强降雨和大冰雹影响布里斯班和内陆地区,风暴横扫昆士兰州东南部",4
苏格兰暴雨洪灾导致火车脱轨死亡的原因调查开始,2
天气博客:天气预报终于下雨了,1
"大雨局部暴雨泉州启动应急响应,晋江本周天气",2
鄂尔多斯部分地区发生冰雹灾害,4
重庆9个区县遭遇暴雨多条河流出现超警戒水位洪水,1
"2.7级小地震Fagradalsfjall(冰岛)东北偏东1.1公里,2020年7月20日,星期一",3
"2.8级小地震Gj西北偏西8.6公里古尔塔(冰岛)2020年6月20日,星期六",3
北部小心雷雨和大风中南部注意防晒,0
京津冀等地全力做好大风应对和森林防灭火服务,0
斯洛文尼亚多地遭遇风暴袭击冰雹如鸡蛋一般大小中新网,4
"雷暴大风冰雹又来了黑龙江降雨降温,局地下降810℃政务澎湃新闻ThePaper",4
贵州向近期暴雨洪涝重灾区紧急下拨省级应急救灾资金500万元,1
浙江衢州暴雨积水严重消防员借吊车营救被困者,2
江西永丰遭暴风冰雹袭击直接经济损失1亿7千万搜狐新闻,4
"冕宁古蔺等地昨夜降大暴雨,阿坝小金县发生泥石流灾害致4人失联",2
山西对汛期安全生产发出通知:暴雨威胁矿井安全时,2
雨何时停南方洪灾风险有多高官方最新研判,1
"飓风亚历克斯来袭时,大曼彻斯特地区有三个洪水警报",1
最大降雨量323毫米强降雨致四川多地受灾,1
六月的冰雹是加拿大与雷暴相关的代价最高的事件之一:怡安,4
"暴雨来袭,多地水浸阳江防汛Ⅳ应急响应提升为Ⅲ级政务澎湃新闻ThePaper",2
淮河发生2020第1号洪水王家坝超警戒水位,1
"萨利的大风、大雨造成了严重破坏,彭萨科拉大桥部分坍塌",0
2020年6月27日星期六圣胡安(阿根廷)2.8级小地震,3
"官员发现美国国旗由于大风而落在地上,放在屋主家门口",0
山泥倾泻和大风导致高原和岛屿的旅行困难,0
廣西容縣:暴雨內澇致群眾被困消防緊急救援,2
国家发展改革委下达2.11亿元救灾应急资金支持暴雨洪涝灾害地区抗灾救灾,1
"2020年8月8日,星期六,千岛群岛(俄罗斯)发生轻磁4.5级地震",3
英国英格兰北部河流泛滥后的洪水救援,1
临沂兰陵一石膏矿采空区发生塌陷专家:与地震关联性不强不会造成更大破坏,3
"意大利卡拉布里亚48小时降雨量450毫米,200人获救",1
"一觉醒来,枪声响起,美国更大风暴要来了",0
"3.5级小地震奥斯特德特瓦特佩克43公里,OAX(墨西哥),星期一,2020年7月13日",3
黑龍江省發布中小河流洪水、地質災害、山洪災害等氣象風險預警,1
"2020年7月15日,星期三,希腊,多德卡尼斯群岛,3.6级小地震",3
"湖北新一轮强降雨来了,伴有局部10级大风",0
"阿萨姆邦洪水影响25L,德里房屋倒塌,UkhandBridge倒塌:印度在暴雨肆虐中挣扎",1
强降水、雷暴大风来袭河南六地暴雨,0
"星期天,怀俄明州中部和南部的高速公路被大风封住西部公路上有黑色的冰",0
又一台风生成17日起广西多地迎来大风较强降雨,0
26日至28日湖南迎新一轮强降雨,1
大风导致卡鲁米特县COVID19试验场暂时关闭,0
天气提醒:太原将迎来大风降温天气,0
米开朗基罗皮斯托莱托的意大利艺术中心在洪水后遭受严重破坏,1
贵州六盘水:暴雨来袭29处路段发生泥石流和边坡垮塌,2
风暴弗朗西斯给英国和爱尔兰带来洪水、破坏性降雨和破纪录的大风,0
"2020年6月18日,星期四,爱达荷州斯坦利西北24公里处发生3.0级小地震",3
印度雨季雨量25年新高极端天气事件将增加,1
端午节小长假最后一天暴雨来袭泰州人快看看具体什么情况呢,2
新一轮降水又来山东中西部局部有大暴雨,1
"雷暴大风将至,山西未来三天,我省多降水天气",0
又有人雨天触电身亡暴雨天怎样出行最安全,2
湖泊出水口堵塞是否引发洪水,1
重庆28个区县降下暴雨多条河流出现超保证水位洪水,1
湖南今明天湘西南湘中地区局地有暴雨21日起雨水逐渐停歇,1
"新一轮冷空气来袭今明两天8月2930号,大雨暴雨大暴雨网易订阅",1
最新消息:山洪暴发和严重雷暴警报停止,1
"警告风暴风速每小时60英里,冰雹在Bucks公司发布。",4
东南亚洪水死亡人数接近40人新风暴来临,1
威海市民注意强降水雷暴大风即将来袭新华网山东频道,0
"中央气象台:6月2728日天气预报,暴雨大暴雨席卷而来",2
连续性暴雨来袭福建省启动防暴雨Ⅳ级应急响应,2
浙江部分列车已停运杭州今夜到明天有大风、暴雨,0
"有可能出现强风暴和冰雹,大雨威胁着草原",4
天水市人民政府园区动态天水国家农业科技园区管委会查看果园冰雹灾情,4
未来三天山西多阵雨或雷阵雨雷暴大风相伴,0
豫鄂部分地区有特大暴雨局地有雷暴大风,0
暴风雨冰雹袭击文山州一地因灾死亡1人,4
四川广元暴雨突袭消防连夜疏散转移70余人,2
日本九州一处农药仓库因暴雨受损674公斤农药泄漏,2
"在接下来的48小时内,大风、风暴潮和涨潮将给科克带来新的洪水威胁",0
"怪事双螺旋云现身北方,太空清晰可见分析:可能带来雷暴冰雹",4
本周中河南还有一场大风出门需做好扬尘防护措施,0
"中度5.7级地震新西兰南岛北部圣阿诺以西10公里,2020年9月3日,星期四",3
"3.1级小地震2020年8月2日星期日,科罗拉多州曼萨尼洛14公里alSUROESTEdeMANZANILLO",3
"一定要看视频和照片捕捉冰雹和闪电,暴风雨席卷休斯顿地区",4
受強降雨和地質災害影響四川高速公路5處阻斷16條國省道尚未搶通,1
"受暴雨影响,煤炭专线大秦铁路一周内两次脱轨",2
"2020年6月18日,星期四,智利(墨西哥)托纳拉苏罗埃斯特144公里处发生4.0级地震",3
2020年7月29日星期三3.5级小地震莫鲁卡海北部(印度尼西亚),3
"小型3.2级地震尼加拉瓜alsuroestedeJiquillillo61公里,2020年7月27日,星期一",3
"轻磁4.6级地震2020年8月10日星期一,加利福尼亚州(美国)孟买海滩东南12公里处",3
应急响应升级今晚开始贵州叒有暴雨、大暴雨媒体澎湃新闻ThePaper,2
"大风过后继续清理,清理,成千上万的人没有电",0
上海向安徽提供防洪援助,1
湖南芷江等地降下鸡蛋大冰雹部分民房受损人员受伤,4
北京西部北部出现较强降雨与短时大风山区有小冰雹,4
"注意接下去几天,松阳仍有阵雨、雷雨、大到暴雨新闻中心丽水网",2
"本周大风中,伊利湖相差10英尺",0
"紧急提醒:未来3小时内,济南市区、长清、历城等将出现冰雹911级雷雨大风和短时强降水媒体澎湃新闻ThePaper",4
"吉林辽宁迎来强降雨,暴雨大暴雨遍地,致灾风险高",2
水利部办公厅发出紧急通知要求:压紧压实责任做好山洪灾害防御,1
国家矿山应急救援汾西队组织开展地震应急救援演练政务澎湃新闻ThePaper,3
日环食、惊雷、暴雨一起来还有什么刷爆了福州人的朋友圈,1
"黑龙江多地有雨,后天迎来全省性雨水,雷暴大风相伴",0
一座大坝如何守护千年古府50年一遇的洪水背后浙江治水有秘笈中国网,1
"蒸煮一整天广东高温不断体感闷热,午后需警惕雷雨大风",0
2020年9月4日星期五(印度尼西亚)班达海5.1级中等地震,3
洪灾频发的坎布桑公路需要采取行动来阻止另一个寒冷的冬天,1
大风警报影响到星期一在怀俄明州东南部的旅行,0
"3.0级小地震2020年8月13日星期四,内华达州(美国)米纳东南30公里处",3
2020年6月28日星期日多米尼加共和国地区3.4级小地震,3
"中国气象局:未来三天6月2729号,大雨暴雨大暴雨王者归来",1
暴雨突袭黔西县城消防员多线出击疏散转移被困群众,2
天气实况更新:南极风暴给新西兰带来大风、大雪,0
"轻磁4.1级地震2020年8月13日,星期四,OAX(墨西哥)24公里alSURESTEdeMATIASROMERO",3
刚刚潍坊突降冰雹鸡蛋大小内附现场图,4
"新一轮大雨暴雨,接踵而至官方预报:局地大暴雨",2
贵州、广西、吉林等地有大雨局地有雷暴大风,0
"上月山东遭遇20年以来最强冰雹天气,6月还有气象专家分析原因",4
2020年6月14日星期日圣胡安(阿根廷)3.1级小地震,3
"陕西发布重要天气报告20日起大范围降雨,局地暴雨",2
"金正恩亲自驾驶雷克萨斯,视察和报道暴雨现场",2
"下班时间,佛山大雨雷暴短时大风",0
浙江衢州暴雨连续当地紧急转移安置,1
"数据告诉你:或许你看了很多关于冰雹的新闻,但其实它越来越懒了",4
盐城响水遭遇8级大风袭击200多户房屋受损21人受伤,0
湖南解除暴雨三级应急响应,2
国家发展改革委紧急下达3.09亿元救灾应急资金支持暴雨洪涝灾害地区抗灾救灾,1
雷雨、冰雹在路上媒体澎湃新闻ThePaper,4
"2020年8月17日,星期一,波多黎各,拉帕格拉西南6公里处发生3.2级小地震",3
