comment,pos
"四川木里暴雨引发泥石流,紧急疏散318户1447人",2
重庆33个区县降暴雨当地启动防汛Ⅳ级应急响应,2
四川冕宁626特大暴雨灾害受灾最严重区域画面曝光,2
气象局警报:今天埃尔帕索出现今年第一次大风警报,0
强降雨入侵山东或有风暴、冰雹等灾害天气山东频道人民网,4
大风导致密歇根州东南部数千人停电,0
"紧急提醒大暴雨10级雷暴大风正在派送又双叒叕一波龙舟水来了,至于周末",0
断电:PGE将索诺马县早期停电归咎于大风事件,0
3.0级小地震4公里alOestedeLimon。(哥斯达黎加)2020年7月30日星期四,3
大雾大风成主角,0
"3.1级小地震2020年7月22日,星期三,尼加拉瓜,马萨查帕86公里处",3
山东部分地区今日雷雨伴大风国庆首日西北部等地仍有阴雨,0
"突发,实拍阳泉市狂风暴雨现场部分地区突降冰雹",4
"2020年10月8日,星期四,南桑威奇群岛地区,5.2级中等地震",3
中国最大的淡水湖周围发生了前所未有的洪水,1
"山西平顺遭遇暴雨冰雹,县城及部分乡镇发生内涝",4
靖边县8月4日晚预计有大到暴雨局地大暴雨靖边新闻信息网,2
新西兰将迎来十年来最大风暴气象机构对多地区发布警报新闻频道西安网,0
强降雨、雷暴大风将来袭江西三部门联合发紧急通知,0
"龙舟水又来了暴雨8级大风,东莞人的周末要泡汤",0
2.9级小地震2020年7月30日星期四(智利)15公里alNOdeAndacollo,3
越南中部等地暴雨已致28人死亡,2
"山东天气1秒变脸下午到夜间13市有雷雨大风,下班途中请备好雨具",0
"3.1级小地震2020年7月16日,星期四,尼加拉瓜科西古纳,北波托西13公里",3
"四川冕宁特大暴雨已致19人遇难、3人失联据冕宁县政府新闻办公室官方微博,冕宁县626特大暴雨灾害情况通报:截至7月3日17时,在持续搜救过程中发现彝海镇2名失联人员已遇难。目前,彝海镇有16",2
"2020年7月9日,星期四,波多黎各,拉帕格拉东南3公里处发生2.9级小地震",3
飓风亚历克斯给英国部分地区带来暴雨和大风,0
"气温骤降10℃冷空气杀到,广西将迎大雨、暴雨、雷暴大风",0
注意降温暴雨大风又来捣乱了,0
"小震级3.5级地震2020年8月1日星期六,帕农贡(古董)(菲律宾)北纬60西032公里",3
"强雷雨8级大风,七夕过后与你相约媒体澎湃新闻ThePaper",0
这些霍尔县的道路由于洪水、风暴破坏而关闭,1
山西平顺遭遇暴雨冰雹县城及部分乡镇发生内涝,4
英国天气预报:英国人遭遇暴雨、无情大风和闪电威胁,0
"北京遭遇冰雹降雨天气,市排水集团启动一级响应",4
"3.1级小地震2020年8月3日,星期一,圣何塞(西方民都罗)(菲律宾)西南77W044公里",3
江苏长江以北地区三天内有较强降雨,1
"2020年6月15日,星期一,所罗门群岛吉佐西南174公里发生5.1级中等地震",3
"2020年6月27日,星期六,多米尼加共和国地区(特克斯和凯科斯群岛)3.3级小地震",3
湖北咸宁普降暴雨消防紧急救援转移被困民众,2
圣埃斯皮里托44个城镇发布暴雨、风暴和冰雹警报。见列表回复:耶路撒冷,4
"贵州毕节发生4.5级地震,沪昆铁路相关区段线路已封锁",3
"3.4级轻微地震2020年7月18日,星期六,格罗(墨西哥)佩塔兰89公里处的alSUROESTEdePETATLAN",3
"2020年8月11日,星期二,希腊南部3.2级小地震",3
2020年6月12日星期五日本琉球群岛4.7级地震,3
"湖北新一轮强降雨来了,伴有局部10级大风",0
襄阳:工地被淹十五名工人被困消防员强渡洪水救援,1
"内蒙古多地暴雨引发山洪:救助被困人员近500人,1人死亡",1
注意广西将迎强降雨、短时雷暴大风天气,0
"灾害管理小组高度戒备,因为西开普省预报有雨、雪和大风",0
"确定了,140毫米大暴雨下午启动,大到暴雨大暴雨,天气预报",2
"湖北恩施建始暴雨破历史极值,已致5死1失联七环视频澎湃新闻ThePaper",2
"轻微3.8级地震危地马拉北部萨拉马14公里,2020年7月20日星期一",3
所罗门群岛霍尼亚拉附近发生里氏5.5级地震,3
"3.9级小地震2020年8月2日星期日,OAX(墨西哥)57公里alSUROESTEdeSPEDROPOCHUTLA",3
"2020年6月23日,星期二,3.4级小地震莫鲁卡海北部(印度尼西亚)",3
沅陵:暴雨致国道塌方中断公路部门全力抢修保畅通,2
"云南昭通强降雨洪灾:居民凌晨紧急离家车内避险,有电瓶车被冲走",1
轻磁4.1级地震2020年8月13日星期四(智利)51公里alSEdeSocaire,3
紧急福州持续性暴雨来袭,1
圣安娜大风将在圣迭戈感恩节之夜增加野火风险,0
山西平顺遭遇暴雨冰雹县城及部分乡镇发生内涝,4
"警报发布后,风暴席卷东海岸,带来破坏性的风和高尔夫球大小的冰雹",4
"2020年6月22日星期一,智利东北偏斜61公里处发生3.3级小地震",3
下面是Wayanad如何利用微降雨数据成功地减少了季风的破坏,1
"雷雨、大风、冰雹即将上线,学会应急避险看这里政务澎湃新闻ThePaper",4
受欢迎的杜瓦尔玉米迷宫在大雨和大风袭击华盛顿西部后被摧毁,0
旱情持续东北旱区最重的辽宁要来一场透雨了,1
重庆暴雨致1人死1人失踪6万余人受灾,2
雷雨冰雹齐上线端午假期要泡汤了政务澎湃新闻ThePaper,4
费城地区有60英里小时的风暴和冰雹警告,4
吉林省气象局关于重大气象灾害(雪灾、冻害、大风)Ⅳ级应急响应升级至Ⅲ级的决定,0
广西地震局:靖西近期不排除发生4级左右余震的可能,3
冻雨大风长春遭遇极端天气,0
"8级大风暴雨,商丘天气接下来是雨雨雨雨",0
"贝加尔湖风暴出现,雷雨冰雹又要突袭东北未来10天还将持续多雨",4
"2020年7月29日星期三,印度(中国)沿北纬244公里处发生轻磁4.9级地震",3
贵州毕节市赫章县发生4.5级地震,3
对温尼伯湖马尼托巴湖南岸发布大风影响警报,0
"当龙卷风警报结束时,辛科县一些地区出现大冰雹",4
暴雨不停这里已有44万人受灾水利部发声,2
"暴风雪席拉:大风中树倒在车上,男子死亡",0
"2.8级小地震2020年8月9日,星期日,波多黎各,MariaAntonia东南11公里处",3
我省多地遭遇大风冰雹天气未来几天临夏市天气将恢复晴好政务澎湃新闻ThePaper,4
"中央气象台:6月2830日天气预报,以下城市遍地暴雨大到暴雨",2
广西将迎强降雨、短时雷暴大风天气,0
"「气象灾害(暴雨)Ⅳ级应急响应」湖南再迎雨水相对集中期,湘中以北局地暴雨需谨防洪涝",1
两股冷空气制造大风降温山东鲁西北等地最低温2℃有霜冻,0
"3.7级小地震北卡罗来纳州圣罗萨利亚72公里,BCS(墨西哥),星期四,2020年7月23日",3
"罕见天津西青等地突遭激烈冰雹袭击,现场仿若下过大雪",4
今年山东强对流天气特别多5月出现8个冰雹日,4
"280毫米特大暴雨今晚开启未来3天,大雨暴雨,天气预报",1
"寒潮、降雪、大风全来明起吉林省猛降10多度,再回零度以下",0
冷空气夹击强降水短时大风即将到南海政务澎湃新闻ThePaper,0
"还有暴雨刚刚,苏州连夜作出部署",2
"科罗拉多州东北部发布大风警报,数百名格里利居民失去电力",0
未来几天内蒙古全区大部大风降温,0
"2020年6月17日,星期三,加利福尼亚州波德菲什25公里处发生2.7级小地震",3
北方气温大幅上升伴有大风多地森林火险气象等级偏高风干物燥加强火源管控注意防火,0
四川甘孜:暴雨引发泥石流816名学生紧急撤离,2
"2020年6月21日,星期日,冰岛达利克西北12公里处发生4.2级地震",3
贵州惠水遭遇特大暴雨多部门联合参与抢险救灾工作,2
"受持续强降雨影响,湖北和江苏多地启动防汛一级响应",1
8级大风雷雨逐渐包围广东局部暴雨,0
注意降温暴雨大风又来捣乱了,0
昨日空气污染3至4级周日将迎来大风降温,0
"热带风暴伽马暴雨袭击尤卡坦半岛,暴雨、大风",0
"新南威尔士州RivertonWY于10月14日凌晨2:09发布大风警报,直至10月14日晚上7:00MDT",0
战暴雨斗冰雹四平交警全力守护群众生命财产安全,4
"广州天气:暴雨8级大风,凶猛的龙舟水又来啦",0
"注意保暖贵州平均气温降5℃以上,这些地方还有大到暴雨",2
图片画廊:强烈的十月风暴产生大量冰雹报告今天下午,4
"2020年7月1日星期三,莫鲁卡海北部(印度尼西亚)2.9级小地震",3
辽宁遭暴雨侵袭致城市内涝紧急转移逾12万人镇江市化工有限责任公司,2
